{
  "$schema": "http://json-schema.org/draft-04/schema#",
  "$id": "https://raw.githubusercontent.com/umccr/orcabus/main/docs/schemas/events/workflowmanager/WorkflowRunStateChange.schema.json",
  "description": "EventBridge custom event schema for orcabus.workflowmanager@WorkflowRunStateChange",
  "title": "AWSEvent",
  "type": "object",
  "required": [
    "detail-type",
    "detail",
    "source"
  ],
  "properties": {
    "id": {
      "type": "string"
    },
    "region": {
      "type": "string"
    },
    "resources": {
      "type": "array",
      "items": {
        "type": "string"
      }
    },
    "source": {
      "type": "string"
    },
    "time": {
      "type": "string",
      "format": "date-time"
    },
    "version": {
      "type": "string"
    },
    "account": {
      "type": "string"
    },
    "detail-type": {
      "type": "string"
    },
    "detail": {
      "$ref": "#/definitions/WorkflowRunStateChange"
    }
  },
  "definitions": {
    "WorkflowRunStateChange": {
      "type": "object",
      "required": [
        "portalRunId",
        "timestamp",
        "status",
        "workflowName",
        "workflowVersion",
        "workflowRunName"
      ],
      "properties": {
        "portalRunId": {
          "type": "string"
        },
        "timestamp": {
          "type": "string",
          "format": "date-time"
        },
        "status": {
          "type": "string"
        },
        "workflowName": {
          "type": "string"
        },
        "workflowVersion": {
          "type": "string"
        },
        "workflowRunName": {
          "type": "string"
        },
        "linkedLibraries": {
          "type": "array",
          "items": {
            "$ref": "#/definitions/LibraryRecord"
          }
        },
        "payload": {
          "$ref": "#/definitions/Payload"
        }
      }
    },
    "LibraryRecord": {
      "type": "object",
      "required": [
        "libraryId",
        "orcabusId"
      ],
      "properties": {
        "libraryId": {
          "type": "string"
        },
        "orcabusId": {
          "type": "string"
        }
      }
    },
    "Payload": {
      "type": "object",
      "required": [
        "refId",
        "version",
        "data"
      ],
      "properties": {
        "refId": {
          "type": "string"
        },
        "version": {
          "type": "string"
        },
        "data": {
          "type": "object"
        }
      }
    }
  }
}